{
  "schema_version": "2.0.0",
  "profile_id": "fisma_agency_security",
  "profile_version": "1.0.0",
  "authority_manifest_id": "ato-authorities-2026-07-10-draft",
  "generated_at": "2026-07-14T16:00:00Z",
  "qualification_status": "draft",
  "certification_class": null,
  "impact_level": "moderate",
  "assessment_items": [
    {
      "assessment_item_type": "nist_control",
      "assessment_item_id": "AC-1",
      "title": "Policy and Procedures",
      "requirement_text": "Develop, document, and disseminate access control policy and procedures.",
      "force": "MUST",
      "owner": "system_owner",
      "applicability": {
        "paths": ["agency_fisma"],
        "classes": [],
        "impact_levels": ["moderate"],
        "affects": ["agency"]
      },
      "authority_refs": [
        {
          "authority_id": "nist.sp.800-53r5",
          "source_pointer": "/controls/AC-1"
        }
      ],
      "required_evidence_kinds": ["evidence_document"],
      "model_analysis_allowed": false
    }
  ],
  "artifact_requirements": [
    {
      "artifact_id": "agency_security_plan",
      "display_name": "Agency security plan excerpt",
      "required": true,
      "owner": "agency",
      "official_schema_authority_id": null,
      "human_readable_required": true,
      "machine_readable_required": false,
      "export_paths": ["human/security-plan.md"],
      "authority_refs": [
        {
          "authority_id": "nist.sp.800-53r5",
          "source_pointer": "/artifacts/agency_security_plan"
        }
      ]
    }
  ],
  "cadence_rules": [],
  "status_policy": {
    "allowed_statuses": ["supported", "partial", "unsupported", "insufficient_evidence"],
    "no_evidence_status": "insufficient_evidence",
    "incomplete_context_ceiling": "partial",
    "all_stale_ceiling": "partial",
    "system_may_be_more_favorable_than_model": false,
    "exact_row_coverage_required": true,
    "repair_attempts": 1
  }
}
